Category,Resume
Full Stack,"Education Details September 2014 to May 2018 Bachelor of Science in Computer Science XYZ University Full Stack Developer Full Stack Developer - CodeCraft Innovations Skill Details HTML5- Experience - 48 months CSS3- Experience - 48 months JavaScript- Experience - 48 months React.js- Experience - 36 months Node.js- Experience - 36 months MongoDB- Experience - 36 months Express.js- Experience - 36 months SQL- Experience - 36 months Responsive Web Design- Experience - 48 monthsCompany Details company - CodeCraft Innovations description - CodeCraft Innovations is a startup focused on developing innovative web-based solutions for small businesses. As a Full Stack Developer, I was involved in designing and implementing web applications using modern technologies. Responsible for developing RESTful APIs, integrating databases, and ensuring the scalability and performance of web applications."
Data Science,"Education Details January 2018 to May 2022 Bachelor of Science in Data Science UVW University Data Scientist Data Scientist - DataMinds Solutions Skill Details Python- Experience - 36 months R- Experience - 24 months Machine Learning- Experience - 36 months Deep Learning- Experience - 24 months Natural Language Processing- Experience - 24 months Big Data Technologies (Hadoop, Spark)- Experience - 24 monthsCompany Details company - DataMinds Solutions description - DataMinds Solutions specializes in data science and analytics solutions. As a Data Scientist, I utilized Python and R for machine learning and deep learning projects. Employed big data technologies like Hadoop and Spark for large-scale data analysis and processing."
QA Testing,"Education: B.Sc. in Computer Science, XYZ University Experience: QA Engineer at TechCheck Innovations Details: - Seasoned QA Engineer with 4 years of experience in ensuring software quality - Proficient in manual testing, automated testing with Selenium, and test planning and strategy - Skilled in defect tracking and management, with a focus on delivering high-quality products - Experienced in API testing and regression testing, ensuring robust and reliable software solutions."
QA Testing,"Education: Bachelor of Engineering in Computer Science, ABC University Experience: QA Analyst at QualityTech Solutions Details: - Experienced QA Analyst with 5 years of hands-on experience in software quality assurance - Proficient in manual testing techniques, automated testing using Selenium, and test case design - Skilled in test planning and strategy, ensuring comprehensive test coverage and effective defect management - Strong expertise in regression testing and API testing, ensuring the reliability and stability of software products."
QA Testing,"Education: B.Sc. in Information Technology, DEF University Experience: QA Specialist at TestPro Services Details: - Skilled QA Specialist with 3 years of experience in software testing and quality assurance - Proficient in manual testing methodologies and automated testing using industry-standard tools - Experienced in test planning, execution, and defect tracking, ensuring adherence to quality standards - Strong problem-solving skills and attention to detail, ensuring thorough testing of software applications."
QA Testing,"Education: Bachelor of Computer Applications, GHI University Experience: Senior QA Tester at QualityAssure Tech Details: - Senior QA Tester with 6 years of extensive experience in software quality assurance - Expertise in manual testing techniques, test case design, and automated testing using Selenium - Proficient in test planning and strategy, ensuring comprehensive test coverage and efficient defect management - Experienced in regression testing and API testing, ensuring the reliability and robustness of software solutions."
QA Testing,"Education: B.Sc. in Computer Engineering, JKL University Experience: QA Lead at SoftwareVerify Solutions Details: - Seasoned QA Lead with 8 years of experience in leading software testing projects - Proficient in manual testing methodologies, automated testing using industry-standard tools, and test case design - Skilled in test planning and strategy, ensuring effective test coverage and timely defect resolution - Experienced in leading teams, mentoring junior testers, and driving quality initiatives."
QA Testing,"Education: Bachelor of Science in Computer Science, MNO University Experience: QA Tester at TechTest Innovations Details: - Experienced QA Tester with 4 years of hands-on experience in software quality assurance - Proficient in manual testing techniques, automated testing using Selenium, and defect tracking - Skilled in test planning and strategy, ensuring thorough test coverage and effective defect management - Experienced in regression testing and API testing, ensuring the reliability and stability of software products."
QA Testing,"Education: B.Tech. in Information Technology, PQR University Experience: QA Engineer at QualityCheck Tech Details: - QA Engineer with 5 years of experience in software testing and quality assurance - Proficient in manual testing methodologies, automated testing using Selenium, and test case design - Skilled in test planning and strategy, ensuring comprehensive test coverage and efficient defect management - Experienced in regression testing and API testing, ensuring the reliability and robustness of software solutions."
QA Testing,"Education: Bachelor of Engineering in Computer Science, STU University Experience: QA Analyst at SoftwareTest Solutions Details: - Skilled QA Analyst with 4 years of experience in software testing and quality assurance - Proficient in manual testing techniques, automated testing using Selenium, and test case design - Experienced in test planning and strategy, ensuring comprehensive test coverage and effective defect management - Strong expertise in regression testing and API testing, ensuring the reliability and stability of software products."
QA Testing,"Education: Bachelor of Science in Information Technology, UVW University Experience: Senior QA Tester at TestMaster Services Details: - Senior QA Tester with 7 years of extensive experience in software quality assurance - Expertise in manual testing methodologies, test case design, and automated testing using Selenium - Proficient in test planning and strategy, ensuring comprehensive test coverage and efficient defect management - Experienced in regression testing and API testing, ensuring the reliability and robustness of software solutions."
QA Testing,"Education: B.Sc. in Computer Science, XYZ University Experience: QA Engineer at TechCheck Innovations Details: - Experienced QA Engineer with 4 years of experience in ensuring software quality - Proficient in manual testing, automated testing with Selenium, and test planning and strategy - Skilled in defect tracking and management, ensuring high-quality product delivery - Experienced in API testing and regression testing, ensuring robust and reliable software solutions."
